{
  "copyright": "Copyright 2023-2024 NXP",
  "license": "SPDX-License-Identifier: BSD-3-Clause",
  "version": "1.1.0",
  "vendor": "NXP",
  "devices": [
    {
      "board": "",
      "device": {
        "id": "MCXA144",
        "name": "MCXA144",
        "family": "MCXA1XX",
        "memory": [
          {
            "location": "0x00000000",
            "size": "0x00040000",
            "type": "Flash",
            "flash-driver": "MCXA1xx.cfx"
          },
          {
            "location": "0x20000000",
            "size": "0x0000e000",
            "type": "RAM"
          },
          {
            "location": "0x04000000",
            "size": "0x00003000",
            "type": "RAM"
          }
        ],
        "cores": [
          {
            "type": "cm33",
            "name": "cm33"
          }
        ]
      },
      "debug": {
        "protocol": "swd",
        "swo": true,
        "bootromstall": "0x4009123C",
        "preconnect-script": "LS_preconnect_MCXA1XX.scp"
      }
    }
  ]
}