{
  "copyright": "Copyright 2025 NXP",
  "license": "SPDX-License-Identifier: BSD-3-Clause",
  "version": "1.1.0",
  "vendor": "NXP",
  "devices": [
    {
      "board": "",
      "device": {
        "id": "LPC54607J256",
        "name": "LPC54607J256",
        "family": "LPC546xx",
        "memory": [
          {
            "location": "0x00000000",
            "size": "0x00040000",
            "type": "Flash",
            "flash-driver": "LPC5460x_256K.cfx"
          },
          {
            "location": "0x20000000",
            "size": "0x00018000",
            "type": "RAM"
          },
          {
            "location": "0x04000000",
            "size": "0x00008000",
            "type": "RAM"
          },
          {
            "location": "0x40100000",
            "size": "0x00002000",
            "type": "RAM"
          }
        ],
        "cores": [
          {
            "type": "cm4",
            "name": "cm4"
          }
        ]
      },
      "debug": {
        "protocol": "swd",
        "swo": true
      }
    }
  ]
}