{
  "copyright": "Copyright 2025 NXP",
  "license": "SPDX-License-Identifier: BSD-3-Clause",
  "version": "1.1.0",
  "vendor": "NXP",
  "devices": [
    {
      "board": "FRDM-MCXA366",
      "device": {
        "id": "MCXA366",
        "name": "MCXA366",
        "family": "MCXA3XX",
        "memory": [
          {
            "location": "0x00000000",
            "size": "0x00100000",
            "type": "Flash",
            "flash-driver": "MCXA3xx.cfx"
          },
          {
            "location": "0x20000000",
            "size": "0x0003c000",
            "type": "RAM"
          },
          {
            "location": "0x04002000",
            "size": "0x00002000",
            "type": "RAM"
          },
          {
            "location": "0x04000000",
            "size": "0x00002000",
            "type": "RAM"
          }
        ],
        "cores": [
          {
            "type": "cm33",
            "name": "cm33"
          }
        ]
      },
      "debug": {
        "protocol": "swd",
        "swo": true,
        "bootromstall": "0x4009123C",
        "preconnect-script": "LS_preconnect_MCXA3XX.scp"
      }
    }
  ]
}