{
  "copyright": "Copyright 2023-2024 NXP",
  "license": "SPDX-License-Identifier: BSD-3-Clause",
  "version": "1.1.0",
  "vendor": "NXP",
  "devices": [
    {
      "board": "HVP-KE18F",
      "device": {
        "id": "MKE18F512xxx16",
        "name": "MKE18F16",
        "family": "KE1x",
        "memory": [
          {
            "location": "0x00000000",
            "size": "0x00080000",
            "type": "Flash",
            "flash-driver": "FTFE_4K.cfx"
          },
          {
            "location": "0x20000000",
            "size": "0x00008000",
            "type": "RAM"
          },
          {
            "location": "0x1fff8000",
            "size": "0x00008000",
            "type": "RAM"
          },
          {
            "location": "0x14000000",
            "size": "0x00001000",
            "type": "RAM"
          }
        ],
        "cores": [
          {
            "type": "cm4",
            "name": "cm4"
          }
        ]
      },
      "debug": {
        "protocol": "swd",
        "swo": true,
        "connect-script": "kinetisconnect.scp",
        "masserase-script": "kinetismasserase.scp"
      }
    }
  ]
}