{
  "copyright": "Copyright 2025 NXP",
  "license": "SPDX-License-Identifier: BSD-3-Clause",
  "version": "1.1.0",
  "vendor": "NXP",
  "devices": [
    {
      "board": "",
      "device": {
        "id": "K32L2B11xxxxA",
        "name": "K32L2B11A",
        "family": "K32L2B11A",
        "memory": [
          {
            "location": "0x00000000",
            "size": "0x00010000",
            "type": "Flash",
            "flash-driver": "K32L2B.cfx"
          },
          {
            "location": "0x1fffe000",
            "size": "0x00008000",
            "type": "RAM"
          }
        ],
        "cores": [
          {
            "type": "cm0plus",
            "name": "cm0plus"
          }
        ]
      },
      "debug": {
        "protocol": "swd",
        "swo": false,
        "connect-script": "kinetisconnect.scp",
        "masserase-script": "kinetismasserase.scp"
      }
    }
  ]
}