{
  "copyright": "Copyright 2025 NXP",
  "license": "SPDX-License-Identifier: BSD-3-Clause",
  "version": "1.1.0",
  "vendor": "NXP",
  "devices": [
    {
      "board": "",
      "device": {
        "id": "LPC54S005",
        "name": "LPC54S005",
        "family": "LPC540xx",
        "memory": [
          {
            "location": "0x00000000",
            "size": "0x00030000",
            "type": "RAM"
          },
          {
            "location": "0x20000000",
            "size": "0x00028000",
            "type": "RAM"
          },
          {
            "location": "0x40100000",
            "size": "0x00002000",
            "type": "RAM"
          }
        ],
        "cores": [
          {
            "type": "cm4",
            "name": "cm4"
          }
        ]
      },
      "debug": {
        "protocol": "swd",
        "swo": true,
        "bootromstall": "0x40000040"
      }
    }
  ]
}